[
  {
    "clause": "9.1.1.1",
    "en_versions": {
      "3.2.1": true,
      "4.1.1": "unverified"
    },
    "title": "Non-text Content",
    "wcag": {
      "sc": "1.1.1",
      "level": "A",
      "versions": [
        "2.0",
        "2.1"
      ],
      "understanding_url": "https://www.w3.org/WAI/WCAG21/Understanding/non-text-content.html"
    },
    "act_rules": [
      {
        "id": "23a2a8",
        "name": "Image has non-empty accessible name",
        "url": "https://www.w3.org/WAI/standards-guidelines/act/rules/23a2a8/",
        "approved": true,
        "outcomes": {
          "passed": "further testing needed",
          "failed": "not satisfied",
          "inapplicable": "further testing needed"
        }
      },
      {
        "id": "59796f",
        "name": "Image button has non-empty accessible name",
        "url": "https://www.w3.org/WAI/standards-guidelines/act/rules/59796f/",
        "approved": true,
        "outcomes": {
          "passed": "further testing needed",
          "failed": "not satisfied",
          "inapplicable": "further testing needed"
        }
      },
      {
        "id": "7d6734",
        "name": "SVG element with explicit role has non-empty accessible name",
        "url": "https://www.w3.org/WAI/standards-guidelines/act/rules/7d6734/",
        "approved": true,
        "outcomes": {
          "passed": "further testing needed",
          "failed": "not satisfied",
          "inapplicable": "further testing needed"
        }
      },
      {
        "id": "8fc3b6",
        "name": "Object element rendering non-text content has non-empty accessible name",
        "url": "https://www.w3.org/WAI/standards-guidelines/act/rules/8fc3b6/",
        "approved": true,
        "outcomes": {
          "passed": "further testing needed",
          "failed": "not satisfied",
          "inapplicable": "further testing needed"
        }
      },
      {
        "id": "e88epe",
        "name": "Image not in the accessibility tree is decorative",
        "url": "https://www.w3.org/WAI/standards-guidelines/act/rules/e88epe/proposed/",
        "approved": false,
        "outcomes": {
          "passed": "further testing needed",
          "failed": "not satisfied",
          "inapplicable": "further testing needed"
        }
      },
      {
        "id": "qt1vmo",
        "name": "Image accessible name is descriptive",
        "url": "https://www.w3.org/WAI/standards-guidelines/act/rules/qt1vmo/",
        "approved": true,
        "outcomes": {
          "passed": "further testing needed",
          "failed": "not satisfied",
          "inapplicable": "further testing needed"
        }
      }
    ],
    "engines": [
      {
        "engine": "accesslint-core",
        "engine_version": "0.21.0",
        "rule_id": "text-alternatives/img-alt",
        "via": "act-implementation",
        "act_rule_id": "23a2a8",
        "consistency": "partial"
      },
      {
        "engine": "accesslint-core",
        "engine_version": "0.21.0",
        "rule_id": "text-alternatives/input-image-alt",
        "via": "act-implementation",
        "act_rule_id": "59796f",
        "consistency": "partial"
      },
      {
        "engine": "accesslint-core",
        "engine_version": "0.21.0",
        "rule_id": "text-alternatives/object-alt",
        "via": "act-implementation",
        "act_rule_id": "8fc3b6",
        "consistency": "partial"
      },
      {
        "engine": "accesslint-core",
        "engine_version": "0.21.0",
        "rule_id": "text-alternatives/role-img-alt",
        "via": "act-implementation",
        "act_rule_id": "23a2a8",
        "consistency": "partial"
      },
      {
        "engine": "accesslint-core",
        "engine_version": "0.21.0",
        "rule_id": "text-alternatives/svg-img-alt",
        "via": "act-implementation",
        "act_rule_id": "7d6734",
        "consistency": "partial"
      },
      {
        "engine": "alfa",
        "engine_version": "0.118.0",
        "rule_id": "sia-r2",
        "via": "act-implementation",
        "act_rule_id": "23a2a8",
        "consistency": "complete"
      },
      {
        "engine": "alfa",
        "engine_version": "0.118.0",
        "rule_id": "sia-r28",
        "via": "act-implementation",
        "act_rule_id": "59796f",
        "consistency": "complete"
      },
      {
        "engine": "alfa",
        "engine_version": "0.118.0",
        "rule_id": "sia-r43",
        "via": "act-implementation",
        "act_rule_id": "7d6734",
        "consistency": "complete"
      },
      {
        "engine": "alfa",
        "engine_version": "0.118.0",
        "rule_id": "sia-r63",
        "via": "act-implementation",
        "act_rule_id": "8fc3b6",
        "consistency": "complete"
      },
      {
        "engine": "axe-core",
        "engine_version": "4.10.2",
        "rule_id": "image-alt",
        "via": "act-implementation",
        "act_rule_id": "23a2a8",
        "consistency": "complete"
      },
      {
        "engine": "axe-core",
        "engine_version": "4.10.2",
        "rule_id": "input-image-alt",
        "via": "act-implementation",
        "act_rule_id": "59796f",
        "consistency": "complete"
      },
      {
        "engine": "axe-core",
        "engine_version": "4.10.2",
        "rule_id": "object-alt",
        "via": "act-implementation",
        "act_rule_id": "8fc3b6",
        "consistency": "complete"
      },
      {
        "engine": "axe-core",
        "engine_version": "4.10.2",
        "rule_id": "role-img-alt",
        "via": "act-implementation",
        "act_rule_id": "23a2a8",
        "consistency": "complete"
      },
      {
        "engine": "axe-core",
        "engine_version": "4.10.2",
        "rule_id": "svg-img-alt",
        "via": "act-implementation",
        "act_rule_id": "7d6734",
        "consistency": "complete"
      },
      {
        "engine": "equal-access",
        "engine_version": "3.1.42-rc.0",
        "rule_id": "aria_id_unique:Pass_0,Fail_1",
        "via": "act-implementation",
        "act_rule_id": "59796f",
        "consistency": "complete"
      },
      {
        "engine": "equal-access",
        "engine_version": "3.1.42-rc.0",
        "rule_id": "imagebutton_alt_exists:Pass_0,Pass_1,Pass_2,Fail",
        "via": "act-implementation",
        "act_rule_id": "59796f",
        "consistency": "complete"
      },
      {
        "engine": "equal-access",
        "engine_version": "3.1.42-rc.0",
        "rule_id": "img_alt_valid:pass,fail_blank_alt,fail_no_alt,fail_blank_title",
        "via": "act-implementation",
        "act_rule_id": "23a2a8",
        "consistency": "partial"
      },
      {
        "engine": "equal-access",
        "engine_version": "3.1.42-rc.0",
        "rule_id": "object_text_exists:pass,fail_no_text_alternative",
        "via": "act-implementation",
        "act_rule_id": "8fc3b6",
        "consistency": "complete"
      },
      {
        "engine": "qualweb",
        "engine_version": "3.0.0",
        "rule_id": "Image button has accessible name",
        "via": "act-implementation",
        "act_rule_id": "59796f",
        "consistency": "complete"
      },
      {
        "engine": "qualweb",
        "engine_version": "3.0.0",
        "rule_id": "Image has accessible name",
        "via": "act-implementation",
        "act_rule_id": "23a2a8",
        "consistency": "complete"
      },
      {
        "engine": "qualweb",
        "engine_version": "3.0.0",
        "rule_id": "Object element has non-empty accessible name",
        "via": "act-implementation",
        "act_rule_id": "8fc3b6",
        "consistency": "complete"
      },
      {
        "engine": "qualweb",
        "engine_version": "3.0.0",
        "rule_id": "svg element with explicit role has accessible name",
        "via": "act-implementation",
        "act_rule_id": "7d6734",
        "consistency": "complete"
      },
      {
        "engine": "sortsite",
        "engine_version": "6.55",
        "rule_id": "AccHtmlImgNoAlt",
        "via": "act-implementation",
        "act_rule_id": "23a2a8",
        "consistency": "complete"
      },
      {
        "engine": "sortsite",
        "engine_version": "6.55",
        "rule_id": "AccHtmlInputImageNoAlt",
        "via": "act-implementation",
        "act_rule_id": "59796f",
        "consistency": "complete"
      },
      {
        "engine": "sortsite",
        "engine_version": "6.55",
        "rule_id": "AccHtmlObjectNoAccName",
        "via": "act-implementation",
        "act_rule_id": "8fc3b6",
        "consistency": "complete"
      },
      {
        "engine": "sortsite",
        "engine_version": "6.55",
        "rule_id": "AccHtmlSvgElementNoName",
        "via": "act-implementation",
        "act_rule_id": "7d6734",
        "consistency": "complete"
      },
      {
        "engine": "total-validator",
        "engine_version": "17.4.0",
        "rule_id": "E860",
        "via": "act-implementation",
        "act_rule_id": "23a2a8",
        "consistency": "complete"
      },
      {
        "engine": "total-validator",
        "engine_version": "17.4.0",
        "rule_id": "E860",
        "via": "act-implementation",
        "act_rule_id": "7d6734",
        "consistency": "complete"
      },
      {
        "engine": "total-validator",
        "engine_version": "17.4.0",
        "rule_id": "P865",
        "via": "act-implementation",
        "act_rule_id": "8fc3b6",
        "consistency": "complete"
      },
      {
        "engine": "total-validator",
        "engine_version": "17.4.0",
        "rule_id": "W889",
        "via": "act-implementation",
        "act_rule_id": "59796f",
        "consistency": "complete"
      },
      {
        "engine": "total-validator-browser",
        "engine_version": "17.4.0",
        "rule_id": "E860",
        "via": "act-implementation",
        "act_rule_id": "23a2a8",
        "consistency": "complete"
      },
      {